{
  "skill": "report-translation",
  "model": "synthetic-fixture",
  "n_reports": 10,
  "qc": {
    "method": "llm_judge",
    "n_evaluated": 10,
    "n_pass": 10,
    "n_fail": 0,
    "n_unknown": 0,
    "pass_rate": 1.0
  },
  "language": {
    "method": "llm_detect",
    "n_evaluated": 10,
    "n_non_english": 0,
    "non_english_rate": 0.0
  },
  "token_preservation": {
    "n_reports_with_tokens": 6,
    "n_reports_token_dropped": 0,
    "preservation_rate": 1.0
  }
}
